{
  "project_id": "critical_thinking",
  "title": "What The Fuck Happened To Critical Thinking?",
  "source_script_path": "production/projects/script_critical_thinking.txt",
  "format": "9:16 vertical video",
  "canvas": {
    "width": 1080,
    "height": 1920,
    "aspect_ratio": "9:16",
    "status": "canonical_invariant"
  },
  "manifest_version": "0.1.0",
  "approved_routes": [
    "human",
    "claude_design",
    "canva",
    "sourced_media",
    "local_tooling",
    "hybrid"
  ],
  "available_profiles": [
    "editorial_grunge",
    "urban_punk",
    "none",
    "bespoke",
    "unresolved"
  ],
  "unit_count": 47,
  "approval_state": {
    "gate_a_decomposition_approval": {
      "status": "pending_human_review",
      "description": "Human review of unit boundaries, route assignments, blockers, and visual profile selections before any scene production.",
      "approved_by": null,
      "approved_at": null
    },
    "gate_b_evidence_readiness": {
      "status": "deferred",
      "description": "Verification of factual claims, sourcing of news stories, and acquisition of third-party media clips prior to asset generation.",
      "approved_by": null,
      "approved_at": null
    },
    "gate_c_rough_assembly": {
      "status": "deferred",
      "description": "Review of rough timeline assembly of talking-head, graphics, and sourced clips prior to final sound design and color grade.",
      "approved_by": null,
      "approved_at": null
    },
    "gate_d_final_publication": {
      "status": "deferred",
      "description": "Human authority final editorial sign-off and publication approval.",
      "approved_by": null,
      "approved_at": null
    }
  },
  "unresolved_issues": [
    "Scene 4: Selection of specific copyright-cleared or fair-use audio/clip for Dennis Leary 'I\\'m an Asshole'.",
    "Scene 4: Sourcing precise clip of Star Trek TOS 'Patterns of Force' (Spock 'good-looking Nazi').",
    "Scene 4: Selection and curation of specific Trump and politician self-contradiction clips.",
    "Scene 6: Editorial decision on specific online creators to feature in 'least favourite creators who are truly radicalizers' montage.",
    "Scene 8: Sourcing Seinfeld clip (Newman refusing broccoli, Kenny Rogers Roasters episode).",
    "Scene 9: Sourcing editorial stills/clips for Data Center and Israeli Flag / Netanyahu bipartisan consensus moment.",
    "Scene 10: Factual verification of Tobi Lütke vote-buying comment/tweet and context before production.",
    "Scene 10: Factual verification and precise neutral wording of Elon Musk incident to avoid asserting contested characterizations as fact.",
    "Scene 10: Factual verification of David Ellison staff homes report details.",
    "Scene 15: Sourcing Bad Boys film excerpt ('You\\'re the detective. Go detect some shit.').",
    "End Card: Editorial decision on final channel brand handle and visual lockup."
  ],
  "production_units": [
    {
      "unit_id": "CT-001",
      "scene_ref": "SCENE 1 — HOOK",
      "name": "On-Camera Opening Direct Address",
      "script_span": "One of the things that fuckin’ grinds me right now is the sheer lack of critical thinking skills I’m seeing out in the world. [BEAT] Like…",
      "takeaway": "Hook viewer with authentic frustration direct to camera regarding the collapse of critical thinking.",
      "on_screen_copy": null,
      "unresolved_placeholder": null,
      "routing": {
        "primary_route": "human",
        "supporting_routes": [],
        "rationale": "Direct-to-camera presenter establishes voice, authentic emotion, and narrative premise.",
        "confidence": "high"
      },
      "visual_treatment": {
        "profile": "none",
        "pattern": null,
        "viewer_sees": "Presenter direct to camera, medium close-up, dark neutral studio environment.",
        "continuity_elements": [
          "presenter"
        ],
        "transition_in": "Hard cut from black",
        "transition_out": "Cut into rapid chaotic montage"
      },
      "motion": {
        "verbs": [
          "PAUSE"
        ],
        "intent": "Conversational pause on 'Like...' sets up contrast before chaotic montage."
      },
      "dependencies": {
        "talking_head": [
          "DEP-HUM-01"
        ],
        "third_party_media": [],
        "evidence_research": [],
        "documents_headlines": [],
        "generated_assets": [],
        "design_system": [],
        "editorial_decisions": [
          "DEP-DEC-04"
        ]
      },
      "output": {
        "expected_artifact": "Talking-head master video take",
        "media_type": "video/mp4",
        "downstream_dependency": "Master assembly Hook sequence"
      },
      "readiness": {
        "status": "blocked_human_recording",
        "blockers": [
          "blocked_human_recording"
        ]
      },
      "timing": {
        "estimated_seconds": 7.5,
        "confidence": "medium",
        "basis": "narration_estimate"
      }
    },
    {
      "unit_id": "CT-002",
      "scene_ref": "SCENE 1 — HOOK",
      "name": "Cultural & Political Chaos Montage",
      "script_span": "[FAST MONTAGE begins underneath] What in the utter fuck are we even doing? [MONTAGE: political screaming / social-media arguments / ridiculous headlines / culture-war clips / billionaire headlines / talking heads] Because apparently we’ve collectively decided that actually thinking about shit is optional.",
      "takeaway": "Provide overwhelming sensory proof of modern societal cognitive chaos.",
      "on_screen_copy": null,
      "unresolved_placeholder": null,
      "routing": {
        "primary_route": "sourced_media",
        "supporting_routes": [
          "local_tooling"
        ],
        "rationale": "Rapid montage of third-party broadcast, social media, and headline clips assembled to rhythm.",
        "confidence": "high"
      },
      "visual_treatment": {
        "profile": "bespoke",
        "pattern": null,
        "viewer_sees": "Rapid-fire 9:16 montage cut to presenter narration cadence; split screens and flashing news clips.",
        "continuity_elements": [],
        "transition_in": "Cut in underneath presenter audio",
        "transition_out": "Smash cut to title card"
      },
      "motion": {
        "verbs": [
          "REVEAL",
          "REPLACE"
        ],
        "intent": "Rapid visual replacements induce sensory cognitive overload."
      },
      "dependencies": {
        "talking_head": [],
        "third_party_media": [
          "DEP-MED-01"
        ],
        "evidence_research": [],
        "documents_headlines": [],
        "generated_assets": [],
        "design_system": [],
        "editorial_decisions": [
          "DEP-DEC-04"
        ]
      },
      "output": {
        "expected_artifact": "Montage sub-sequence video",
        "media_type": "video/mp4",
        "downstream_dependency": "Hook sequence assembly"
      },
      "readiness": {
        "status": "blocked_asset",
        "blockers": [
          "blocked_asset"
        ]
      },
      "timing": {
        "estimated_seconds": 5.5,
        "confidence": "medium",
        "basis": "narration_estimate"
      }
    },
    {
      "unit_id": "CT-003",
      "scene_ref": "SCENE 1 — HOOK",
      "name": "Smash Cut Title Card",
      "script_span": "[SMASH CUT TO TITLE] WHAT THE FUCK HAPPENED TO CRITICAL THINKING?",
      "takeaway": "Establish video thesis question with maximum visual impact and unmistakable clarity.",
      "on_screen_copy": "WHAT THE FUCK HAPPENED TO CRITICAL THINKING?",
      "unresolved_placeholder": null,
      "routing": {
        "primary_route": "claude_design",
        "supporting_routes": [
          "canva"
        ],
        "rationale": "Governed kinetic typography title card utilizing design system canvas geometry.",
        "confidence": "high"
      },
      "visual_treatment": {
        "profile": "urban_punk",
        "pattern": "stencil-punch",
        "viewer_sees": "High-contrast full-canvas woodcut headline in asphalt ground with acid lime and photocopy white punch.",
        "continuity_elements": [
          "video_title"
        ],
        "transition_in": "Smash cut from montage",
        "transition_out": "Hard cut to Scene 2 on-camera setup"
      },
      "motion": {
        "verbs": [
          "REVEAL",
          "RESOLVE",
          "PAUSE"
        ],
        "intent": "Instant typographic impact landing the controlling thesis question."
      },
      "dependencies": {
        "talking_head": [],
        "third_party_media": [],
        "evidence_research": [],
        "documents_headlines": [],
        "generated_assets": [
          "DEP-GEN-01"
        ],
        "design_system": [
          "DEP-DS-01",
          "DEP-DS-03",
          "DEP-DS-10"
        ],
        "editorial_decisions": [
          "DEP-DEC-04"
        ]
      },
      "output": {
        "expected_artifact": "Rendered 9:16 title card motion graphic",
        "media_type": "video/mp4",
        "downstream_dependency": "Act 1 transition"
      },
      "readiness": {
        "status": "ready",
        "blockers": []
      },
      "timing": {
        "estimated_seconds": 2.5,
        "confidence": "high",
        "basis": "designed_hold"
      }
    },
    {
      "unit_id": "CT-004",
      "scene_ref": "PART 1 — POLITICS / SCENE 2 — EVERYBODY PICK A TEAM",
      "name": "Politics Setup Direct Address",
      "script_span": "[ON CAMERA] Let’s start with the obvious one. Politics.",
      "takeaway": "Transition into first analytical chapter: partisan political polarization.",
      "on_screen_copy": null,
      "unresolved_placeholder": null,
      "routing": {
        "primary_route": "human",
        "supporting_routes": [],
        "rationale": "Presenter direct-to-camera anchors the chapter transition.",
        "confidence": "high"
      },
      "visual_treatment": {
        "profile": "none",
        "pattern": null,